<?xml version="1.0" encoding="UTF-8" ?>
<devices xmlns:xsi="http://www.w3.org/2001/XMLSchema-instance"
         xmlns="https://www.devices.by/xml"
         xsi:schemaLocation="https://www.devices.by/xml devices.xsd">

    <device id="id1" device-group="video-card">
        <name>Video-card ASUS GeForce GTX 1060 6GB GDDR5 [ROG STRIX-GTX1060-O6G-GAMING]</name>
        <origin>China</origin>
        <price>1150.00</price>
        <type>
            <peripheral>false</peripheral>
            <energy-consumption>120</energy-consumption>
            <cooler>true</cooler>
            <com>0</com>
            <usb>0</usb>
            <lpt>0</lpt>
        </type>
        <critical>true</critical>
    </device>

    <device id="id2" device-group="motherboard">
        <name>Motherboard ASRock B560M Pro4</name>
        <origin>China</origin>
        <price>318.27</price>
        <type>
            <peripheral>false</peripheral>
            <energy-consumption>125</energy-consumption>
            <cooler>false</cooler>
            <com>0</com>
            <usb>4</usb>
            <lpt>0</lpt>
        </type>
        <critical>true</critical>
    </device>
</devices>